<?xml version="1.0" encoding="UTF-8"?>
<!-- XML Sample Message of message hierarchy                                          -->
<!-- Message:             ADC BAS Tax Regulatory v1.0 Rev. 5                          -->
<!-- Transaction:         AA - Audit Data Collection Rev. 271                         -->
<!-- Datamodel:           Audit Data Collection Datamodel, version HEAD Rev. 347      -->
<!-- XML tagset used:     AdcsML                                                      -->
<!-- Generated at:        02-05-2021 15:29:43                                         -->
<!-- Generated using:     EC-Design 2.5.0 (http://www.ec-design.nl)                   -->
<!-- Generated by:        Jan Vrijenhoek (Digitect)                                   -->
<!-- Organisation:        Digitect B.V. (Digitect)                                    -->
<!-- NOTE:    This sample message was generated automatically: manual modifications will be lost -->
<AdcBasTaxRegulatory xsi:schemaLocation="http://schemas.iso.org/AdcsML/Messages/AdcBasTaxRegulatory-v1 AdcBasTaxRegulatory-v1.0.xsd"
		xmlns="http://schemas.iso.org/AdcsML/Messages/AdcBasTaxRegulatory-v1"
		xmlns:xsi="http://www.w3.org/2001/XMLSchema-instance">
	<BasTaxRgltry>
		<RgltrCd>USTAX1234</RgltrCd>
		<RgltrCntryCd>US</RgltrCntryCd>
		<RgltrRegion>NY</RgltrRegion>
		<RgltrNm>US TAX Authorities</RgltrNm>
		<RgltrRole>Collect tax money.</RgltrRole>
		<RgltrPblAcntNum>ACC123456789</RgltrPblAcntNum>
		<RgltrAccrlAcntNum>ACC123456789</RgltrAccrlAcntNum>
		<RgltrExpnsAcntNum>ACC123456789</RgltrExpnsAcntNum>
		<RgltrId>1234</RgltrId>
		<RgltrRprtOrg>BS001</RgltrRprtOrg>
		<RgltrActiveFlag>true</RgltrActiveFlag>
		<BusSg>
			<BusSgCd>1234</BusSgCd>
		</BusSg>
	</BasTaxRgltry>
</AdcBasTaxRegulatory>
